[
  {
    "tap_id": "TAP-012",
    "title": "NEP Communication Failure",
    "alarm_types": [
      "NEP-COMM-FAIL"
    ],
    "severity": "critical",
    "service_impact": "Management degraded",
    "applicable_models": [
      "SM",
      "SMX"
    ]
  },
  {
    "tap_id": "TAP-047",
    "title": "Clear OC12 Loss of Signal (LOS)",
    "alarm_types": [
      "OC12-LOS",
      "OC12-LOF"
    ],
    "severity": "critical",
    "service_impact": "Circuit down",
    "applicable_models": [
      "SMX"
    ]
  },
  {
    "tap_id": "TAP-048",
    "title": "Clear T1 Loss of Signal (LOS)",
    "alarm_types": [
      "DS1-LOS"
    ],
    "severity": "major",
    "service_impact": "Service impact",
    "applicable_models": [
      "SM",
      "SMX"
    ]
  }
]
